<xs:schema xmlns:xs="http://www.w3.org/2001/XMLSchema" elementFormDefault="qualidied">
    <xs:element name="Universidad">
        <xs:complexType>
            <xs:sequence>
                <xs:element name="Estudiante" maxOccurs="unbounded">
                    <xs:complexType>
                        <xs:sequence>
                            <xs:element name="Nombre">
                                <xs:simpleType>
                                    <xs:restriction base="xs:string">
                                        <xs:minLength value="3"/>
                                        <xs:maxLength value="50"/>
                                    </xs:restriction>
                                </xs:simpleType>
                            </xs:element>
                            <xs:element name="Edad">
                                <xs:simpleType>
                                    <xs:restriction base="xs:integer">
                                        <xs:minInclusive value="18"/>
                                        <xs:maxInlusive value="100"/>
                                    </xs:restriction>
                                </xs:simpleType>
                            </xs:element>
                            <xs:element name="Programa">
                                <xs:simpleType>
                                    <xs:restriction base="xs:string">
                                        <xs:minLength value="3"/>
                                    </xs:restriction>
                                </xs:simpleType>
                            </xs:element>
                            <xs:element name="Correo" minOccurs="0">
                                <xs:simpleType>
                                    <xs:restriction base="xs:string">
                                        <xs:pattern value="[a-zA-Z0-9._-]+@[a-zA-Z0-9]+.[a-z]{2,3}"/>
                                    </xs:restriction>
                                </xs:simpleType>
                            </xs:element>
                        </xs:sequence>
                        <xs:attribute name="id" type="xs:ID" use="required"/>
                    </xs:complexType>
                </xs:element>
            </xs:sequence>
        </xs:complexType>
    </xs:element>
</xs:schema>